<?xml version="1.0" encoding="ISO-8859-1"?>
<!-- edited with XMLSPY v5 rel. 2 U (http://www.xmlspy.com) by Bogdan Jeram (E.S.O.) -->
<Type xmlns:xsi="http://www.w3.org/2001/XMLSchema-instance" xmlns="Alma/ACSError" xsi:schemaLocation="Alma/ACSError ACSError.xsd" name="ACSErrTypeTest" type="900902" _prefix="alma">
	<Code name="ACSErrTestOK" shortDescription="Test OK" description="Test OK"/>
	<ErrorCode name="ACSErrTest0" shortDescription="Test error 0" description="Test error 0"/>
	<ErrorCode name="ACSErrTest1" shortDescription="Test error 1" description="Test error 1"/>
	<ErrorCode name="ACSErrTest2" shortDescription="Test error 2" description="Test error 2"/>
	<ErrorCode name="ACSErrTest3" shortDescription="Test error 3" description="Test error 3"/>
	<ErrorCode name="ACSErrTest4" shortDescription="Test error 4" description="Test error 4" _suppressExceptionGeneration="1"/>
	<ErrorCode name="ACSErrTest5" shortDescription="Test error 5" description="Test error 5" _suppressExceptionGeneration="true"/>
</Type>

